{
  "passed" : true,
  "driverSha256" : "2A659C17395D16CF765CD3598370B6F3E1EFFFFAA095444316C41B852AF7064B",
  "driverVersion" : "dm7.jdbc.driver.DmDriver 3.0.7.1.3.32 (Build 2014.01.21)",
  "serverVersion" : "DM DBMS 7.1.6.95",
  "targetFingerprint" : "804da0b0f701264df2556b45a80e820bdfd25a848d57864f93dfbd2f04566d79",
  "cases" : [ {
    "name" : "url-diagnostics-and-connection",
    "passed" : true,
    "durationMs" : 9
  }, {
    "name" : "driver-isolation-and-versions",
    "passed" : true,
    "durationMs" : 353
  }, {
    "name" : "chinese-round-trip-and-metadata",
    "passed" : true,
    "durationMs" : 1446
  }, {
    "name" : "parameterized-update-delete",
    "passed" : true,
    "durationMs" : 1659
  }, {
    "name" : "limits-and-timeouts",
    "passed" : true,
    "durationMs" : 953
  }, {
    "name" : "atomic-ddl-preflight",
    "passed" : true,
    "durationMs" : 362
  }, {
    "name" : "non-atomic-mixed-failure",
    "passed" : true,
    "durationMs" : 639
  }, {
    "name" : "production-query-timeout",
    "passed" : true,
    "durationMs" : 3143
  }, {
    "name" : "cancellation-capability",
    "passed" : true,
    "durationMs" : 6189,
    "supported" : false
  }, {
    "name" : "test-purpose-release-exclusion",
    "passed" : true,
    "durationMs" : 1452
  }, {
    "name" : "cleanup-and-zero-release",
    "passed" : true,
    "durationMs" : 418
  } ],
  "cleanupConfirmed" : true
}